{
  "$schema": "http://json-schema.org/draft-07/schema#",
  "$id": "https://agentic-abm.example/schemas/master-context.schema.json",
  "title": "Agentic ABM Master Context",
  "description": "Central data contract for the Agentic ABM engine. All downstream agents consume this structure for targeting, messaging, prioritization, and orchestration decisions.",
  "type": "object",
  "additionalProperties": false,
  "required": [
    "company",
    "icp",
    "buyers",
    "competitors",
    "gtm"
  ],
  "properties": {
    "company": {
      "type": "object",
      "description": "Ground-truth information about the vendor company. This anchors strategic context so every agent reasons from the same business fundamentals.",
      "additionalProperties": false,
      "required": [
        "name",
        "website",
        "industry",
        "stage",
        "product_description",
        "value_proposition",
        "differentiators",
        "pricing_model",
        "acv_range",
        "reference_customers"
      ],
      "properties": {
        "name": {
          "type": "string",
          "minLength": 1,
          "description": "Official company name. Used across account research, personalization tokens, and CRM sync to avoid identity mismatches."
        },
        "website": {
          "type": "string",
          "format": "uri",
          "description": "Primary website URL. Enables enrichment agents to crawl canonical content and align messaging with current positioning."
        },
        "industry": {
          "type": "string",
          "minLength": 1,
          "description": "Primary industry category of the company. Helps agents frame category narrative and map competitive alternatives correctly."
        },
        "stage": {
          "type": "string",
          "minLength": 1,
          "description": "Business maturity stage (for example seed, Series A, growth, late stage). Guides channel mix, budget assumptions, and sales motion complexity."
        },
        "product_description": {
          "type": "string",
          "minLength": 1,
          "description": "What the product does in practical terms. Core input for positioning, value articulation, and use-case matching."
        },
        "value_proposition": {
          "type": "string",
          "minLength": 1,
          "description": "Primary customer outcome promised by the product. Used by copywriting and outreach agents to keep messaging outcome-first."
        },
        "differentiators": {
          "type": "array",
          "minItems": 1,
          "items": {
            "type": "string",
            "minLength": 1
          },
          "description": "Distinct strengths versus alternatives. Supports objection handling, battlecards, and persuasive sequencing in multi-touch plays."
        },
        "pricing_model": {
          "type": "string",
          "minLength": 1,
          "description": "How pricing is structured (for example per seat, usage-based, platform fee). Influences qualification logic and expected deal structure."
        },
        "acv_range": {
          "type": "object",
          "description": "Expected annual contract value boundaries used for scoring account fit and prioritization.",
          "additionalProperties": false,
          "required": [
            "currency",
            "min",
            "max"
          ],
          "properties": {
            "currency": {
              "type": "string",
              "minLength": 3,
              "maxLength": 3,
              "description": "ISO 4217 currency code (for example INR, USD). Ensures financial values are interpreted consistently across agents."
            },
            "min": {
              "type": "number",
              "minimum": 0,
              "description": "Lower bound of typical ACV. Used to filter out too-small opportunities and align effort with expected return."
            },
            "max": {
              "type": "number",
              "minimum": 0,
              "description": "Upper bound of typical ACV. Helps identify unusually large opportunities and calibrate enterprise-selling workflows."
            }
          }
        },
        "reference_customers": {
          "type": "array",
          "minItems": 1,
          "items": {
            "type": "string",
            "minLength": 1
          },
          "description": "Known customer logos or names that can be cited as proof. Enables trust signals in outreach and relevant social proof selection."
        }
      }
    },
    "icp": {
      "type": "object",
      "description": "Ideal customer profile constraints used to score and segment target accounts with precision.",
      "additionalProperties": false,
      "required": [
        "target_industries",
        "company_size_by_employees",
        "company_size_by_arr",
        "funding_stages",
        "geographies",
        "tech_stack_signals",
        "buying_triggers",
        "negative_icp"
      ],
      "properties": {
        "target_industries": {
          "type": "array",
          "minItems": 1,
          "items": {
            "type": "string",
            "minLength": 1
          },
          "description": "Industry segments with strongest product-market fit. Powers account sourcing and vertical-specific personalization."
        },
        "company_size_by_employees": {
          "type": "object",
          "description": "Headcount range defining the ideal organizational size for deployment and adoption success.",
          "additionalProperties": false,
          "required": [
            "min",
            "max"
          ],
          "properties": {
            "min": {
              "type": "integer",
              "minimum": 1,
              "description": "Minimum employee count in ICP. Avoids under-scaled accounts with low urgency or budget."
            },
            "max": {
              "type": "integer",
              "minimum": 1,
              "description": "Maximum employee count in ICP. Prevents targeting accounts that need a different sales motion."
            }
          }
        },
        "company_size_by_arr": {
          "type": "object",
          "description": "Revenue range that maps to expected purchasing power and readiness.",
          "additionalProperties": false,
          "required": [
            "currency",
            "min",
            "max"
          ],
          "properties": {
            "currency": {
              "type": "string",
              "minLength": 3,
              "maxLength": 3,
              "description": "ISO 4217 currency code for ARR values. Allows uniform ARR comparisons across systems."
            },
            "min": {
              "type": "number",
              "minimum": 0,
              "description": "Lower ARR boundary for target accounts. Filters out companies unlikely to support the expected deal size."
            },
            "max": {
              "type": "number",
              "minimum": 0,
              "description": "Upper ARR boundary for target accounts. Keeps focus on the intended mid-market motion."
            }
          }
        },
        "funding_stages": {
          "type": "array",
          "minItems": 1,
          "items": {
            "type": "string",
            "minLength": 1
          },
          "description": "Preferred funding stages of target accounts. Acts as a proxy for maturity, budget confidence, and growth intent."
        },
        "geographies": {
          "type": "array",
          "minItems": 1,
          "items": {
            "type": "string",
            "minLength": 1
          },
          "description": "Regions or countries where the go-to-market motion is strongest. Guides territory routing and localized outreach."
        },
        "tech_stack_signals": {
          "type": "array",
          "minItems": 1,
          "items": {
            "type": "string",
            "minLength": 1
          },
          "description": "Technologies that indicate technical fit or integration readiness. Used for intent scoring and qualification enrichment."
        },
        "buying_triggers": {
          "type": "array",
          "minItems": 1,
          "items": {
            "type": "string",
            "minLength": 1
          },
          "description": "Observable events signaling elevated purchase likelihood. Drives prioritization and timing-sensitive campaign activation."
        },
        "negative_icp": {
          "type": "array",
          "items": {
            "type": "string",
            "minLength": 1
          },
          "description": "Exclusion criteria for poor-fit accounts. Prevents wasted sales effort and protects conversion efficiency."
        }
      }
    },
    "buyers": {
      "type": "object",
      "description": "Buying persona and committee context for account-level engagement orchestration.",
      "additionalProperties": false,
      "required": [
        "target_titles",
        "seniority_levels",
        "buying_committee_size",
        "pain_points",
        "unstated_needs"
      ],
      "properties": {
        "target_titles": {
          "type": "array",
          "minItems": 1,
          "items": {
            "type": "string",
            "minLength": 1
          },
          "description": "Job titles most likely to influence or own the purchase. Used for contact selection and role-specific messaging."
        },
        "seniority_levels": {
          "type": "array",
          "minItems": 1,
          "items": {
            "type": "string",
            "minLength": 1
          },
          "description": "Priority seniority bands in the buying journey. Helps sequence executive and practitioner engagement correctly."
        },
        "buying_committee_size": {
          "type": "object",
          "description": "Expected number of stakeholders in a typical deal cycle. Shapes multi-threading plans and stakeholder coverage checks.",
          "additionalProperties": false,
          "required": [
            "min",
            "max"
          ],
          "properties": {
            "min": {
              "type": "integer",
              "minimum": 1,
              "description": "Minimum expected number of committee members. Ensures plays avoid single-threaded risk."
            },
            "max": {
              "type": "integer",
              "minimum": 1,
              "description": "Maximum expected number of committee members. Informs complexity estimates and content distribution plans."
            }
          }
        },
        "pain_points": {
          "type": "array",
          "minItems": 1,
          "items": {
            "type": "string",
            "minLength": 1
          },
          "description": "Explicit problems buyers recognize today. Anchors campaign hooks and relevance in outreach copy."
        },
        "unstated_needs": {
          "type": "array",
          "minItems": 1,
          "items": {
            "type": "string",
            "minLength": 1
          },
          "description": "Latent needs buyers may not verbalize directly. Helps agents craft insight-led messaging that creates urgency."
        }
      }
    },
    "competitors": {
      "type": "array",
      "minItems": 1,
      "description": "Competitive landscape entries used by battlecard, objection-handling, and positioning agents.",
      "items": {
        "type": "object",
        "additionalProperties": false,
        "required": [
          "name",
          "weaknesses"
        ],
        "properties": {
          "name": {
            "type": "string",
            "minLength": 1,
            "description": "Competitor name. Enables consistent competitor tagging and mention detection across workflows."
          },
          "weaknesses": {
            "type": "array",
            "minItems": 1,
            "items": {
              "type": "string",
              "minLength": 1
            },
            "description": "Known product, service, or commercial gaps. Used to tailor displacement messaging and proof points."
          }
        }
      }
    },
    "gtm": {
      "type": "object",
      "description": "Go-to-market execution preferences and historical signals that influence strategy selection.",
      "additionalProperties": false,
      "required": [
        "win_themes",
        "loss_themes",
        "preferred_channels",
        "crm_in_use",
        "existing_account_list"
      ],
      "properties": {
        "win_themes": {
          "type": "array",
          "minItems": 1,
          "items": {
            "type": "string",
            "minLength": 1
          },
          "description": "Patterns from won deals. Helps agents replicate proven angles in account plans and outreach."
        },
        "loss_themes": {
          "type": "array",
          "minItems": 1,
          "items": {
            "type": "string",
            "minLength": 1
          },
          "description": "Patterns from lost deals. Informs risk flags, messaging pivots, and qualification safeguards."
        },
        "preferred_channels": {
          "type": "array",
          "minItems": 1,
          "items": {
            "type": "string",
            "minLength": 1
          },
          "description": "Primary channels to run ABM plays (for example email, LinkedIn, webinars). Controls channel orchestration strategy."
        },
        "crm_in_use": {
          "type": "string",
          "minLength": 1,
          "description": "Current CRM platform name. Enables integration routing and expected object model assumptions."
        },
        "existing_account_list": {
          "description": "Optional pre-existing account list from CRM or CSV parse output. Null means no list is available yet.",
          "anyOf": [
            {
              "type": "null"
            },
            {
              "type": "array",
              "items": {
                "type": "object",
                "description": "Normalized row parsed from an existing account list source.",
                "additionalProperties": false,
                "required": [
                  "account_name",
                  "domain"
                ],
                "properties": {
                  "account_name": {
                    "type": "string",
                    "minLength": 1,
                    "description": "Account name as represented in source systems. Used for deduplication and routing."
                  },
                  "domain": {
                    "type": "string",
                    "minLength": 1,
                    "description": "Primary web domain for matching and enrichment."
                  },
                  "status": {
                    "type": "string",
                    "description": "Optional lifecycle stage (for example prospect, customer, churned). Supports suppression and prioritization logic."
                  },
                  "owner": {
                    "type": "string",
                    "description": "Optional account owner in CRM. Used for handoff and territory-aware assignment."
                  },
                  "notes": {
                    "type": "string",
                    "description": "Optional free-form context from sales or revops. Helps preserve nuanced account intelligence."
                  }
                }
              }
            }
          ]
        }
      }
    }
  }
}
