{
  "company": {
    "name": "ScalePilot",
    "website": "https://www.scalepilot.ai",
    "industry": "B2B SaaS",
    "stage": "Series A",
    "product_description": "ScalePilot is an AI-assisted revenue intelligence and outbound orchestration platform for startup sales teams.",
    "value_proposition": "Help GTM teams prioritize the right accounts and launch high-conversion, multi-channel ABM plays in days instead of weeks.",
    "differentiators": [
      "India-first data enrichment for startup ecosystems",
      "Built-in buying committee detection for lean sales teams",
      "Playbook automation with rapid experimentation loops"
    ],
    "pricing_model": "Annual subscription with seat + usage tiers",
    "acv_range": {
      "currency": "INR",
      "min": 600000,
      "max": 2400000
    },
    "reference_customers": [
      "FinEdge",
      "DevStack Cloud",
      "PayOrbit"
    ]
  },
  "icp": {
    "target_industries": [
      "FinTech",
      "SaaS Infrastructure",
      "Developer Tools",
      "HR Tech"
    ],
    "company_size_by_employees": {
      "min": 80,
      "max": 700
    },
    "company_size_by_arr": {
      "currency": "INR",
      "min": 50000000,
      "max": 1200000000
    },
    "funding_stages": [
      "Seed+",
      "Series A",
      "Series B"
    ],
    "geographies": [
      "India",
      "UAE",
      "Singapore"
    ],
    "tech_stack_signals": [
      "HubSpot",
      "Salesforce",
      "Segment",
      "Mixpanel",
      "AWS"
    ],
    "buying_triggers": [
      "Recent funding round in last 12 months",
      "VP Sales or Head of Growth hired in last 6 months",
      "Expansion into new geography",
      "Inbound lead growth without corresponding SDR scale-up"
    ],
    "negative_icp": [
      "Services-heavy agencies with no repeatable SaaS product",
      "Pre-revenue startups with fewer than 20 employees",
      "Regulated enterprises requiring on-prem deployment only"
    ]
  },
  "buyers": {
    "target_titles": [
      "Head of Growth",
      "VP Sales",
      "Director Revenue Operations",
      "Founder"
    ],
    "seniority_levels": [
      "Director",
      "VP",
      "C-Level",
      "Founder"
    ],
    "buying_committee_size": {
      "min": 3,
      "max": 6
    },
    "pain_points": [
      "Low outbound conversion despite high SDR activity",
      "Fragmented account intelligence across tools",
      "Poor visibility into multi-threaded deal progression"
    ],
    "unstated_needs": [
      "Confidence in repeatable pipeline creation",
      "Faster experimentation without revops bottlenecks",
      "Board-ready reporting on ABM ROI"
    ]
  },
  "competitors": [
    {
      "name": "Apollo.io",
      "weaknesses": [
        "Generic outreach flows for India-focused segments",
        "Limited contextual account narratives for startup GTM motions"
      ]
    },
    {
      "name": "ZoomInfo",
      "weaknesses": [
        "Higher total cost for mid-market startups",
        "Complex setup for lean revops teams"
      ]
    },
    {
      "name": "Clay",
      "weaknesses": [
        "Steeper learning curve for non-technical SDR managers",
        "Workflow maintenance overhead at scale"
      ]
    }
  ],
  "gtm": {
    "win_themes": [
      "Faster time-to-first-campaign after onboarding",
      "Noticeable lift in meetings booked from focused ICP lists",
      "Strong founder confidence due to transparent account scoring"
    ],
    "loss_themes": [
      "Deals lost when buyers prefer all-in-one CRM suites",
      "Losses in accounts needing deep custom BI integrations",
      "Champion churn mid-cycle without multi-threading"
    ],
    "preferred_channels": [
      "Email",
      "LinkedIn",
      "Founder-led webinars",
      "Partner communities"
    ],
    "crm_in_use": "HubSpot",
    "existing_account_list": [
      {
        "account_name": "NeoLedger",
        "domain": "neoledger.in",
        "status": "prospect",
        "owner": "Aman Singh",
        "notes": "Recently raised Series A; hiring SDRs aggressively."
      },
      {
        "account_name": "SprintHR",
        "domain": "sprinthr.com",
        "status": "customer",
        "owner": "Meera Nair",
        "notes": "Expansion upsell opportunity likely in Q3."
      }
    ]
  }
}
